{
  "schemaVersion": 1,
  "dataset": "satellites",
  "generatedAt": "2026-10-23T11:45:21.841Z",
  "dataAsOf": "2026-10-23T11:45:21.841Z",
  "status": "ok",
  "source": {
    "name": "CelesTrak",
    "url": "https://celestrak.org/NORAD/elements/gp.php?GROUP=stations&FORMAT=JSON"
  },
  "items": [
    {
      "id": "norad-25544",
      "title": "ISS (ZARYA)",
      "catalogId": 25544,
      "objectId": "1998-067A",
      "publishedAt": "2026-10-22T23:36:04.393Z",
      "url": "https://celestrak.org/satcat/table-satcat.php?CATNR=25544"
    },
    {
      "id": "norad-36086",
      "title": "POISK",
      "catalogId": 36086,
      "objectId": "2009-060A",
      "publishedAt": "2026-10-22T23:36:04.393Z",
      "url": "https://celestrak.org/satcat/table-satcat.php?CATNR=36086"
    },
    {
      "id": "norad-48274",
      "title": "CSS (TIANHE)",
      "catalogId": 48274,
      "objectId": "2021-035A",
      "publishedAt": "2026-10-23T04:15:54.796Z",
      "url": "https://celestrak.org/satcat/table-satcat.php?CATNR=48274"
    },
    {
      "id": "norad-49044",
      "title": "ISS (NAUKA)",
      "catalogId": 49044,
      "objectId": "2021-066A",
      "publishedAt": "2026-10-22T23:36:04.393Z",
      "url": "https://celestrak.org/satcat/table-satcat.php?CATNR=49044"
    },
    {
      "id": "norad-49271",
      "title": "FREGAT DEB",
      "catalogId": 49271,
      "objectId": "2011-037PF",
      "publishedAt": "2026-10-22T12:12:45.226Z",
      "url": "https://celestrak.org/satcat/table-satcat.php?CATNR=49271"
    },
    {
      "id": "norad-53239",
      "title": "CSS (WENTIAN)",
      "catalogId": 53239,
      "objectId": "2022-085A",
      "publishedAt": "2026-10-23T02:43:47.498Z",
      "url": "https://celestrak.org/satcat/table-satcat.php?CATNR=53239"
    },
    {
      "id": "norad-54216",
      "title": "CSS (MENGTIAN)",
      "catalogId": 54216,
      "objectId": "2022-143A",
      "publishedAt": "2026-10-23T04:15:54.796Z",
      "url": "https://celestrak.org/satcat/table-satcat.php?CATNR=54216"
    },
    {
      "id": "norad-66515",
      "title": "SZ-21 MODULE",
      "catalogId": 66515,
      "objectId": "2025-246C",
      "publishedAt": "2026-10-23T04:09:32.586Z",
      "url": "https://celestrak.org/satcat/table-satcat.php?CATNR=66515"
    },
    {
      "id": "norad-66906",
      "title": "DUPLEX",
      "catalogId": 66906,
      "objectId": "1998-067XT",
      "publishedAt": "2026-10-23T04:27:22.772Z",
      "url": "https://celestrak.org/satcat/table-satcat.php?CATNR=66906"
    },
    {
      "id": "norad-67683",
      "title": "KNACKSAT-2",
      "catalogId": 67683,
      "objectId": "1998-067YA",
      "publishedAt": "2026-10-22T06:05:43.852Z",
      "url": "https://celestrak.org/satcat/table-satcat.php?CATNR=67683"
    },
    {
      "id": "norad-67685",
      "title": "GXIBA-1",
      "catalogId": 67685,
      "objectId": "1998-067YC",
      "publishedAt": "2026-10-22T05:52:58.416Z",
      "url": "https://celestrak.org/satcat/table-satcat.php?CATNR=67685"
    },
    {
      "id": "norad-67686",
      "title": "UITMSAT-2",
      "catalogId": 67686,
      "objectId": "1998-067YD",
      "publishedAt": "2026-10-20T06:40:10.629Z",
      "url": "https://celestrak.org/satcat/table-satcat.php?CATNR=67686"
    },
    {
      "id": "norad-67687",
      "title": "LEOPARD",
      "catalogId": 67687,
      "objectId": "1998-067YE",
      "publishedAt": "2026-10-22T11:24:51.845Z",
      "url": "https://celestrak.org/satcat/table-satcat.php?CATNR=67687"
    },
    {
      "id": "norad-67688",
      "title": "HMU-SAT2",
      "catalogId": 67688,
      "objectId": "1998-067YF",
      "publishedAt": "2026-10-22T04:56:49.362Z",
      "url": "https://celestrak.org/satcat/table-satcat.php?CATNR=67688"
    },
    {
      "id": "norad-68837",
      "title": "PROGRESS-MS 34",
      "catalogId": 68837,
      "objectId": "2026-093A",
      "publishedAt": "2026-10-22T22:03:10.303Z",
      "url": "https://celestrak.org/satcat/table-satcat.php?CATNR=68837"
    },
    {
      "id": "norad-69049",
      "title": "TIANZHOU-10",
      "catalogId": 69049,
      "objectId": "2026-102A",
      "publishedAt": "2026-10-22T23:39:32.898Z",
      "url": "https://celestrak.org/satcat/table-satcat.php?CATNR=69049"
    },
    {
      "id": "norad-69180",
      "title": "SHENZHOU-23 (SZ-23)",
      "catalogId": 69180,
      "objectId": "2026-113A",
      "publishedAt": "2026-10-22T23:39:32.898Z",
      "url": "https://celestrak.org/satcat/table-satcat.php?CATNR=69180"
    },
    {
      "id": "norad-100057",
      "title": "SOYUZ-MS 29",
      "catalogId": 100057,
      "objectId": "2026-162A",
      "publishedAt": "2026-10-22T22:03:10.303Z",
      "url": "https://celestrak.org/satcat/table-satcat.php?CATNR=100057"
    },
    {
      "id": "norad-100712",
      "title": "PROGRESS-MS 35",
      "catalogId": 100712,
      "objectId": "2026-212A",
      "publishedAt": "2026-10-22T22:03:10.303Z",
      "url": "https://celestrak.org/satcat/table-satcat.php?CATNR=100712"
    },
    {
      "id": "norad-100882",
      "title": "CREW DRAGON 13",
      "catalogId": 100882,
      "objectId": "2026-226A",
      "publishedAt": "2026-10-22T22:03:10.303Z",
      "url": "https://celestrak.org/satcat/table-satcat.php?CATNR=100882"
    },
    {
      "id": "norad-101031",
      "title": "DRAGON CRS-35",
      "catalogId": 101031,
      "objectId": "2026-233A",
      "publishedAt": "2026-10-22T22:03:10.303Z",
      "url": "https://celestrak.org/satcat/table-satcat.php?CATNR=101031"
    }
  ]
}
