{
  "schemaVersion": 1,
  "dataset": "humanitarian",
  "generatedAt": "2026-10-24T20:54:28.325Z",
  "dataAsOf": "2026-07-26T00:00:00.000Z",
  "status": "degraded",
  "source": {
    "name": "ReliefWeb",
    "url": "https://api.reliefweb.int/v2/reports?appname=APPROVAL_REQUIRED&limit=40&preset=latest&fields[include][]=title&fields[include][]=url_alias&fields[include][]=date.original&fields[include][]=date.created&fields[include][]=source.name&fields[include][]=country.name"
  },
  "items": []
}
